{
  "schema_version": "1.0",
  "change_id": "b2c3d4e5-f6a7-4b8c-9d0e-1f2a3b4c5d6e",
  "source_type": "jira_work_item",
  "source_ref": "JIRA-INFRA-7742",
  "ingested_at": "2026-04-21T09:12:00Z",
  "title": "INFRA: Migrate internal message queue client from legacy-mq-lib to async-mq-client v3",
  "raw_text": "## Summary\n\nMigrate all internal service-to-service message queue consumers and producers from the deprecated `legacy-mq-lib` (v1.x) to `async-mq-client` (v3.2). This is a pure infrastructure refactor with no user-visible behavior change.\n\n## Background\n\nThe `legacy-mq-lib` library was internally developed circa 2019 and relies on synchronous blocking I/O. It is incompatible with the current Python 3.11+ async runtime and has been flagged for removal in the Q2 infrastructure dependency audit. `async-mq-client` v3.2 is the approved replacement; it offers equivalent functionality with native async/await support and improved connection pooling.\n\n## Scope\n\nAffected services (all internal, no external-facing APIs):\n- notification-dispatch-worker\n- audit-log-consumer\n- ingest-pipeline-fanout\n- dead-letter-requeue-cron\n\n## What Does NOT Change\n\n- No change to message schema or payload format\n- No change to queue topology, topic names, or routing keys\n- No change to retry logic or dead-letter queue behavior (same semantics, new implementation)\n- No change to any user-facing functionality, API contracts, or UI behavior\n- No change to SLAs or rate limits\n\n## Testing\n\nUnit tests updated to use the new client mock. Integration tests run against a local queue broker in CI. Load test confirmed < 2% throughput difference between old and new client under simulated peak traffic.\n\n## Deployment\n\nBlue/green deployment. Services will be restarted during the next scheduled maintenance window (off-hours). Zero expected downtime for dependent services.",
  "author": {
    "name": "<engineer-infra-team>",
    "role": "Infrastructure Engineer"
  },
  "related_refs": [
    {
      "type": "jira_work_item",
      "ref": "JIRA-INFRA-7600",
      "relation": "parent"
    }
  ],
  "labels": [
    "infrastructure",
    "no-user-impact",
    "refactor",
    "dependency-upgrade",
    "internal-only"
  ],
  "rollout_hints": null
}
